{
  "task_id": "TASK-0545",
  "issue_id": "ISSUE-0655",
  "story_id": "STORY-0545",
  "epic_id": "EPIC-088",
  "sprint_id": "SPRINT-011",
  "role": "IA",
  "outcome": "Definir hipótese, isolamento e critérios de promoção para namespace experimental/labs, registry separado, ModelPacks isolados e bloqueio técnico de ArtifactSet aceito com testes e evidência verificável.",
  "references": [
    "AGENTS.md",
    ".codex/roles/ROLE-006-ia.md",
    "docs/06-delivery/stories/STORY-0545-ISSUE-0655-definir-hipotese-isolamento-e-criterios-de-promocao-namespace-experimental.md",
    "docs/06-delivery/epics/EPIC-088-namespace-experimental-labs-registry-separado-modelpacks-isolados-e-bl.md",
    "contracts/README.md",
    "docs/06-delivery/PHASE-B-REQUIREMENTS-REVIEW-CHARTER.md",
    "docs/07-assurance/ACCEPTANCE_CRITERION_TRACEABILITY.csv",
    "docs/02-architecture/ddd/bounded-contexts/BC-009-ai-recovery.md",
    "docs/02-architecture/ddd/DDD-040-CONTEXT-MAP.md",
    "docs/02-architecture/adrs/ADR-003-bounded-contexts-subdominios-e-linguagem-ubiqua.md",
    "docs/02-architecture/adrs/ADR-004-integracao-entre-contexts-e-modelos-publicados.md",
    "docs/02-architecture/adrs/ADR-005-layout-context-first-e-direcao-de-dependencias.md",
    "docs/02-architecture/adrs/ADR-006-prompts-permanentes-taskenvelope-e-precedencia-de-instrucoes.md",
    "docs/02-architecture/adrs/ADR-007-write-scopes-lanes-paralelas-e-isolamento-de-mudanca.md",
    "docs/02-architecture/adrs/ADR-008-granularidade-de-historias-e-limites-anti-monolito.md",
    "docs/02-architecture/adrs/ADR-051-ai-router-planner-e-escalonamento-classic-first.md",
    "docs/02-architecture/adrs/ADR-052-inference-engine-modelrunner-modelpack-e-offline.md",
    "docs/02-architecture/adrs/ADR-053-reprodutibilidade-cientifica-benchmarks-promocao-e-rollback.md",
    "docs/02-architecture/specifications/SPEC-001-PROMPT-BUNDLE-CONTRACT.md",
    "docs/02-architecture/specifications/SPEC-003-AI-BACKEND-PROTOCOL-CONTRACT.md",
    "docs/02-architecture/specifications/SPEC-004-TEMPLATE-CONTRACT.md",
    "contracts/operations/slo-sli-catalog.yaml",
    "docs/05-operations/CAPACITY_AND_SCALING.md",
    "contracts/operations/external-dependency-register.csv",
    "contracts/operations/vendor-exit-matrix.csv",
    "contracts/operations/cost-model.yaml",
    "docs/05-operations/COST_AND_UNIT_ECONOMICS.md",
    "contracts/operations/recovery-objectives.yaml",
    "docs/05-operations/BACKUP_RESTORE.md",
    "docs/05-operations/OBSERVABILITY.md",
    "docs/04-quality/THREAT_MODEL.md",
    "docs/04-quality/SECURITY_PRIVACY_LGPD.md",
    "contracts/privacy/lgpd-control-matrix.csv",
    "docs/04-quality/LGPD_CONTROL_MODEL.md",
    "contracts/operations/version-and-rollback-matrix.yaml",
    "docs/07-assurance/PHASE-G-CTO-REVIEW-REPORT.md",
    "docs/05-operations/PRODUCTION_READINESS_GATES.md"
  ],
  "allow_paths": [
    "src/ai/dsgeorref_ai/contexts/ai_recovery/namespace-experimental-labs-registry-separado-modelpac/**"
  ],
  "deny_paths": [
    "src/backend/**",
    "src/frontend/**",
    "src/**/epic-*",
    "src/**/issue-*"
  ],
  "acceptance_criteria": [
    "O resultado de “namespace experimental/labs, registry separado, ModelPacks isolados e bloqueio técnico de ArtifactSet aceito” é observável por contrato, interface, artifact ou evidência executável.",
    "Os requisitos vinculados possuem evidência explícita no commit candidato.",
    "Estados de erro e caminhos fail-closed aplicáveis são testados, sem fallback silencioso.",
    "Hipótese, baseline, métrica, budget e critério de abandono são definidos antes da execução."
  ],
  "tests": [
    "test_epic_088_hipotese"
  ],
  "evidence": [
    "evidence/implementation/epic-088/story-0545/",
    "commit candidato e relatório de testes"
  ],
  "dependencies": [
    "STORY-0308",
    "STORY-0504",
    "STORY-0281"
  ],
  "stop_conditions": [
    "Decisão material de produto ou arquitetura não resolvida.",
    "Contrato obrigatório ausente ou contraditório.",
    "Write scope sobrepõe lane ativa.",
    "Aceitação não pode ser demonstrada por teste ou evidência."
  ],
  "acceptance_criterion_ids": [
    "AC-ISSUE-0655-01",
    "AC-ISSUE-0655-02",
    "AC-ISSUE-0655-03",
    "AC-ISSUE-0655-04"
  ],
  "governing_adrs": [
    "ADR-003",
    "ADR-004",
    "ADR-005",
    "ADR-006",
    "ADR-007",
    "ADR-008",
    "ADR-051",
    "ADR-052",
    "ADR-053"
  ],
  "requirement_basis": "DERIVED_CONTROL",
  "requirements_review_status": "PASS",
  "bounded_context": "BC-009",
  "context_map_dependencies": [
    "BC-004",
    "BC-010",
    "BC-015"
  ],
  "domain_model_impact": "LOCAL_MODEL",
  "ddd_review_status": "PASS",
  "adr_review_status": "PASS",
  "adr_baseline": "SAR-v2.9-PHASE-F",
  "applicable_specifications": [
    "SPEC-001",
    "SPEC-003",
    "SPEC-004"
  ],
  "specification_review_status": "PASS",
  "specification_baseline": "SAR-v2.9-PHASE-F",
  "phase_f_review": {
    "status": "PASS",
    "dependencies": {
      "status": "PASS",
      "count": 3,
      "items": [
        "STORY-0308",
        "STORY-0504",
        "STORY-0281"
      ]
    },
    "files": {
      "status": "PASS",
      "allow_paths": [
        "src/ai/dsgeorref_ai/contexts/ai_recovery/namespace-experimental-labs-registry-separado-modelpac/**"
      ],
      "deny_paths": [
        "src/backend/**",
        "src/frontend/**",
        "src/**/epic-*",
        "src/**/issue-*"
      ]
    },
    "api": {
      "applicability": "NOT_APPLICABLE",
      "status": "PASS",
      "contracts": [],
      "contract_sources": []
    },
    "database": {
      "applicability": "NOT_APPLICABLE",
      "status": "PASS",
      "authorities": [],
      "migration_required": false,
      "rollback_required": false
    },
    "frontend": {
      "applicability": "NOT_APPLICABLE",
      "status": "PASS",
      "authorities": []
    },
    "geo": {
      "applicability": "NOT_APPLICABLE",
      "status": "PASS",
      "authorities": []
    },
    "ai": {
      "applicability": "APPLICABLE",
      "status": "PASS",
      "authorities": [
        "ADR-051",
        "ADR-052",
        "ADR-053"
      ],
      "protocol_required": true
    },
    "tests": {
      "status": "PASS",
      "items": [
        "test_epic_088_hipotese"
      ]
    },
    "artifacts": {
      "applicability": "PRODUCT_AND_EVIDENCE",
      "status": "PASS",
      "kinds": [],
      "evidence": [
        "evidence/implementation/epic-088/story-0545/",
        "commit candidato e relatório de testes"
      ],
      "contract": "SPEC-005"
    },
    "acceptance_criteria": {
      "status": "PASS",
      "count": 4,
      "ids": [
        "AC-ISSUE-0655-01",
        "AC-ISSUE-0655-02",
        "AC-ISSUE-0655-03",
        "AC-ISSUE-0655-04"
      ]
    },
    "review": {
      "status": "PASS",
      "required_roles": [
        "QA",
        "Reviewer"
      ],
      "same_candidate_commit": true
    }
  },
  "sprint_review_status": "PASS",
  "sprint_review_baseline": "SAR-v2.9-PHASE-F",
  "phase_g_review": {
    "status": "PASS",
    "risk_tier": "CRITICAL",
    "applicable_controls": [
      "CTO-001",
      "CTO-003",
      "CTO-004",
      "CTO-005",
      "CTO-006",
      "CTO-007",
      "CTO-008",
      "CTO-010",
      "CTO-012",
      "CTO-013",
      "CTO-014",
      "CTO-015"
    ],
    "non_applicable_controls": [
      "CTO-002",
      "CTO-009",
      "CTO-011"
    ],
    "required_evidence": [
      "contracts/operations/slo-sli-catalog.yaml",
      "docs/05-operations/CAPACITY_AND_SCALING.md",
      "contracts/operations/external-dependency-register.csv",
      "contracts/operations/vendor-exit-matrix.csv",
      "contracts/operations/cost-model.yaml",
      "docs/05-operations/COST_AND_UNIT_ECONOMICS.md",
      "contracts/operations/recovery-objectives.yaml",
      "docs/05-operations/BACKUP_RESTORE.md",
      "docs/05-operations/OBSERVABILITY.md",
      "docs/04-quality/THREAT_MODEL.md",
      "docs/04-quality/SECURITY_PRIVACY_LGPD.md",
      "contracts/privacy/lgpd-control-matrix.csv",
      "docs/04-quality/LGPD_CONTROL_MODEL.md",
      "contracts/operations/version-and-rollback-matrix.yaml"
    ],
    "production_gate": "SECURITY_AND_PRIVACY_GATES"
  },
  "cto_review_status": "PASS",
  "cto_review_baseline": "SAR-v3.0-PHASE-G"
}
