{
  "task_id": "TASK-0251",
  "issue_id": "ISSUE-0361",
  "story_id": "STORY-0251",
  "epic_id": "EPIC-042",
  "sprint_id": "SPRINT-012",
  "role": "Tech Lead",
  "outcome": "Materializar notices, citação e manifests para licença, citação, sanitização e revisão externa concluídas com testes e evidência verificável.",
  "references": [
    "AGENTS.md",
    ".codex/roles/ROLE-003-tech-lead.md",
    "docs/06-delivery/stories/STORY-0251-ISSUE-0361-materializar-notices-citacao-e-manifests-licenca-citacao-sanitizacao-e-rev.md",
    "docs/06-delivery/epics/EPIC-042-licenca-citacao-sanitizacao-e-revisao-externa-concluidas.md",
    "docs/01-product/requirements/REQ-CIT-001-releases-publicas-fornecem-metadados-e-instrucoes-de-citacao.md",
    "docs/01-product/requirements/REQ-EPIC-042-cada-tipo-de-codigo-documentacao-dado-modelo-e-fixture-deve-possuir-lice.md",
    "docs/01-product/requirements/REQ-EPIC-043-o-release-train-internal-alpha-beta-1-0-deve-aplicar-gates-explicitos-de-visibilidade-licenc.md",
    "docs/01-product/requirements/REQ-OSS-001-codigo-novo-publicado-sob-licenca-open-source-aprovada-com-notices-e-inv.md",
    "docs/01-product/requirements/REQ-PUB-004-releases-publicas-devem-conter-metadados-de-citacao-autoria-terceiros-e.md",
    "contracts/README.md",
    "docs/06-delivery/PHASE-B-REQUIREMENTS-REVIEW-CHARTER.md",
    "docs/07-assurance/ACCEPTANCE_CRITERION_TRACEABILITY.csv",
    "docs/02-architecture/ddd/bounded-contexts/BC-015-release-installation.md",
    "docs/02-architecture/ddd/DDD-040-CONTEXT-MAP.md",
    "docs/02-architecture/adrs/ADR-002-topologia-do-produto-monolito-modular-e-instancia-unica.md",
    "docs/02-architecture/adrs/ADR-003-bounded-contexts-subdominios-e-linguagem-ubiqua.md",
    "docs/02-architecture/adrs/ADR-004-integracao-entre-contexts-e-modelos-publicados.md",
    "docs/02-architecture/adrs/ADR-005-layout-context-first-e-direcao-de-dependencias.md",
    "docs/02-architecture/adrs/ADR-006-prompts-permanentes-taskenvelope-e-precedencia-de-instrucoes.md",
    "docs/02-architecture/adrs/ADR-007-write-scopes-lanes-paralelas-e-isolamento-de-mudanca.md",
    "docs/02-architecture/adrs/ADR-008-granularidade-de-historias-e-limites-anti-monolito.md",
    "docs/02-architecture/adrs/ADR-016-application-services-uow-erros-e-idempotencia.md",
    "docs/02-architecture/adrs/ADR-037-workers-duraveis-leases-e-fencing.md",
    "docs/02-architecture/adrs/ADR-056-licenciamento-contribuicoes-provider-attribution-e-citacao.md",
    "docs/02-architecture/specifications/SPEC-001-PROMPT-BUNDLE-CONTRACT.md",
    "docs/02-architecture/specifications/SPEC-004-TEMPLATE-CONTRACT.md",
    "contracts/operations/slo-sli-catalog.yaml",
    "docs/05-operations/CAPACITY_AND_SCALING.md",
    "contracts/operations/external-dependency-register.csv",
    "contracts/operations/vendor-exit-matrix.csv",
    "contracts/operations/cost-model.yaml",
    "docs/05-operations/COST_AND_UNIT_ECONOMICS.md",
    "contracts/operations/lock-and-queue-policy.yaml",
    "contracts/operations/recovery-objectives.yaml",
    "docs/05-operations/BACKUP_RESTORE.md",
    "docs/05-operations/OBSERVABILITY.md",
    "docs/04-quality/THREAT_MODEL.md",
    "docs/04-quality/SECURITY_PRIVACY_LGPD.md",
    "contracts/operations/version-and-rollback-matrix.yaml",
    "docs/07-assurance/PHASE-G-CTO-REVIEW-REPORT.md",
    "docs/05-operations/PRODUCTION_READINESS_GATES.md"
  ],
  "allow_paths": [
    "src/backend/dsgeorref/contexts/release_installation/application/licenca-citacao-sanitizacao-e-revisao-externa-concluid/**"
  ],
  "deny_paths": [
    "src/**/epic-*",
    "src/**/issue-*"
  ],
  "acceptance_criteria": [
    "O resultado de “licença, citação, sanitização e revisão externa concluídas” é observável por contrato, interface, artifact ou evidência executável.",
    "Os requisitos REQ-CIT-001, REQ-EPIC-042, REQ-EPIC-043, REQ-OSS-001, REQ-PUB-004 possuem evidência explícita no commit candidato.",
    "Estados de erro e caminhos fail-closed aplicáveis são testados, sem fallback silencioso.",
    "Notices, rights manifests, citação e inventário de terceiros são completos e verificáveis."
  ],
  "tests": [
    "citation_cff_validation",
    "test_layered_spdx_reuse_license_notices_dependency_and_asset_compatibility",
    "test_release_train_visibility_license_sanitization_and_beta_gate",
    "license_and_dependency_inventory",
    "test_epic_042_artefatos"
  ],
  "evidence": [
    "evidence/implementation/epic-042/story-0251/",
    "commit candidato e relatório de testes"
  ],
  "dependencies": [
    "STORY-0250"
  ],
  "stop_conditions": [
    "Decisão material de produto ou arquitetura não resolvida.",
    "Contrato obrigatório ausente ou contraditório.",
    "Write scope sobrepõe lane ativa.",
    "Aceitação não pode ser demonstrada por teste ou evidência."
  ],
  "acceptance_criterion_ids": [
    "AC-ISSUE-0361-01",
    "AC-ISSUE-0361-02",
    "AC-ISSUE-0361-03",
    "AC-ISSUE-0361-04"
  ],
  "governing_adrs": [
    "ADR-002",
    "ADR-003",
    "ADR-004",
    "ADR-005",
    "ADR-006",
    "ADR-007",
    "ADR-008",
    "ADR-016",
    "ADR-037",
    "ADR-056"
  ],
  "requirement_basis": "MIXED",
  "requirements_review_status": "PASS",
  "bounded_context": "BC-015",
  "context_map_dependencies": [
    "BC-013"
  ],
  "domain_model_impact": "LOCAL_MODEL",
  "ddd_review_status": "PASS",
  "adr_review_status": "PASS",
  "adr_baseline": "SAR-v2.9-PHASE-F",
  "applicable_specifications": [
    "SPEC-001",
    "SPEC-004"
  ],
  "specification_review_status": "PASS",
  "specification_baseline": "SAR-v2.9-PHASE-F",
  "phase_f_review": {
    "status": "PASS",
    "dependencies": {
      "status": "PASS",
      "count": 1,
      "items": [
        "STORY-0250"
      ]
    },
    "files": {
      "status": "PASS",
      "allow_paths": [
        "src/backend/dsgeorref/contexts/release_installation/application/licenca-citacao-sanitizacao-e-revisao-externa-concluid/**"
      ],
      "deny_paths": [
        "src/**/epic-*",
        "src/**/issue-*"
      ]
    },
    "api": {
      "applicability": "NOT_APPLICABLE",
      "status": "PASS",
      "contracts": [],
      "contract_sources": []
    },
    "database": {
      "applicability": "NOT_APPLICABLE",
      "status": "PASS",
      "authorities": [],
      "migration_required": false,
      "rollback_required": false
    },
    "frontend": {
      "applicability": "NOT_APPLICABLE",
      "status": "PASS",
      "authorities": []
    },
    "geo": {
      "applicability": "NOT_APPLICABLE",
      "status": "PASS",
      "authorities": []
    },
    "ai": {
      "applicability": "NOT_APPLICABLE",
      "status": "PASS",
      "authorities": [],
      "protocol_required": false
    },
    "tests": {
      "status": "PASS",
      "items": [
        "citation_cff_validation",
        "test_layered_spdx_reuse_license_notices_dependency_and_asset_compatibility",
        "test_release_train_visibility_license_sanitization_and_beta_gate",
        "license_and_dependency_inventory",
        "test_epic_042_artefatos"
      ]
    },
    "artifacts": {
      "applicability": "PRODUCT_AND_EVIDENCE",
      "status": "PASS",
      "kinds": [
        "Manifest"
      ],
      "evidence": [
        "evidence/implementation/epic-042/story-0251/",
        "commit candidato e relatório de testes"
      ],
      "contract": "SPEC-005"
    },
    "acceptance_criteria": {
      "status": "PASS",
      "count": 4,
      "ids": [
        "AC-ISSUE-0361-01",
        "AC-ISSUE-0361-02",
        "AC-ISSUE-0361-03",
        "AC-ISSUE-0361-04"
      ]
    },
    "review": {
      "status": "PASS",
      "required_roles": [
        "QA",
        "Reviewer"
      ],
      "same_candidate_commit": true
    }
  },
  "sprint_review_status": "PASS",
  "sprint_review_baseline": "SAR-v2.9-PHASE-F",
  "phase_g_review": {
    "status": "PASS",
    "risk_tier": "HIGH",
    "applicable_controls": [
      "CTO-001",
      "CTO-003",
      "CTO-004",
      "CTO-005",
      "CTO-006",
      "CTO-008",
      "CTO-009",
      "CTO-010",
      "CTO-012",
      "CTO-013",
      "CTO-015"
    ],
    "non_applicable_controls": [
      "CTO-002",
      "CTO-007",
      "CTO-011",
      "CTO-014"
    ],
    "required_evidence": [
      "contracts/operations/slo-sli-catalog.yaml",
      "docs/05-operations/CAPACITY_AND_SCALING.md",
      "contracts/operations/external-dependency-register.csv",
      "contracts/operations/vendor-exit-matrix.csv",
      "contracts/operations/cost-model.yaml",
      "docs/05-operations/COST_AND_UNIT_ECONOMICS.md",
      "contracts/operations/lock-and-queue-policy.yaml",
      "contracts/operations/recovery-objectives.yaml",
      "docs/05-operations/BACKUP_RESTORE.md",
      "docs/05-operations/OBSERVABILITY.md",
      "docs/04-quality/THREAT_MODEL.md",
      "docs/04-quality/SECURITY_PRIVACY_LGPD.md",
      "contracts/operations/version-and-rollback-matrix.yaml"
    ],
    "production_gate": "BENCHMARK_AND_OPERATIONS_GATES"
  },
  "cto_review_status": "PASS",
  "cto_review_baseline": "SAR-v3.0-PHASE-G"
}
