{
  "task_id": "TASK-0021",
  "issue_id": "ISSUE-0131",
  "story_id": "STORY-0021",
  "epic_id": "EPIC-005",
  "sprint_id": "SPRINT-001",
  "role": "Arquiteto",
  "outcome": "Consolidar slices e liberar integração: migrations, CI, secret/dependency scan e telemetria mínima",
  "references": [
    "AGENTS.md",
    ".codex/roles/ROLE-002-arquiteto.md",
    "docs/06-delivery/stories/STORY-0021-ISSUE-0131-definir-escopo-contratos-e-invariantes-migrations-ci-secret-dependency-sca.md",
    "docs/06-delivery/epics/EPIC-005-migrations-ci-secret-dependency-scan-e-telemetria-minima.md",
    "docs/06-delivery/PHASE-B-REQUIREMENTS-REVIEW-CHARTER.md",
    "docs/07-assurance/ACCEPTANCE_CRITERION_TRACEABILITY.csv",
    "docs/02-architecture/ddd/bounded-contexts/BC-001-engineering-governance.md",
    "docs/02-architecture/ddd/DDD-040-CONTEXT-MAP.md",
    "docs/02-architecture/adrs/ADR-003-bounded-contexts-subdominios-e-linguagem-ubiqua.md",
    "docs/02-architecture/adrs/ADR-006-prompts-permanentes-taskenvelope-e-precedencia-de-instrucoes.md",
    "docs/02-architecture/adrs/ADR-007-write-scopes-lanes-paralelas-e-isolamento-de-mudanca.md",
    "docs/02-architecture/adrs/ADR-008-granularidade-de-historias-e-limites-anti-monolito.md",
    "docs/02-architecture/specifications/SPEC-001-PROMPT-BUNDLE-CONTRACT.md",
    "docs/02-architecture/specifications/SPEC-004-TEMPLATE-CONTRACT.md",
    "docs/02-architecture/adrs/ADR-018-postgresql-postgis-como-system-of-record.md",
    "docs/02-architecture/adrs/ADR-023-artifactset-manifest-e-bundles-imutaveis.md",
    "docs/02-architecture/adrs/ADR-024-publicacao-atomica-checksums-e-content-addressing.md",
    "docs/02-architecture/adrs/ADR-026-schema-registry-migrations-e-compatibilidade.md",
    "contracts/operations/slo-sli-catalog.yaml",
    "docs/05-operations/CAPACITY_AND_SCALING.md",
    "contracts/operations/lock-and-queue-policy.yaml",
    "contracts/operations/external-dependency-register.csv",
    "contracts/operations/vendor-exit-matrix.csv",
    "contracts/operations/cost-model.yaml",
    "docs/05-operations/COST_AND_UNIT_ECONOMICS.md",
    "contracts/operations/recovery-objectives.yaml",
    "docs/05-operations/BACKUP_RESTORE.md",
    "contracts/operations/version-and-rollback-matrix.yaml",
    "docs/03-engineering/DATABASE_MIGRATIONS.md",
    "docs/05-operations/OBSERVABILITY.md",
    "docs/04-quality/THREAT_MODEL.md",
    "docs/04-quality/SECURITY_PRIVACY_LGPD.md",
    "docs/07-assurance/PHASE-G-CTO-REVIEW-REPORT.md",
    "docs/05-operations/PRODUCTION_READINESS_GATES.md"
  ],
  "allow_paths": [
    "contracts/contexts/engineering_governance/fnd/migrations-ci-secret-dependency-scan-e-telemetria-mini/consolidacao/**",
    "docs/02-architecture/design-reviews/migrations-ci-secret-dependency-scan-e-telemetria-mini/consolidacao/**"
  ],
  "deny_paths": [
    "src/**/epic-*",
    "src/**/issue-*"
  ],
  "acceptance_criteria": [
    "Todos os slices vinculados estão concluídos no mesmo baseline candidato.",
    "Cobertura requisito→história permanece integral e sem duplicação normativa.",
    "Contratos e outputs dos slices integram sem colisão ou implementação redundante.",
    "Reviewer registra riscos residuais e libera dependentes."
  ],
  "tests": [
    "test_story_0021_slice_consolidation"
  ],
  "evidence": [
    "evidence/implementation/epic-005/story-0021/",
    "commit candidato e relatório de testes"
  ],
  "dependencies": [
    "STORY-0706",
    "STORY-0707"
  ],
  "stop_conditions": [
    "Decisão material de produto ou arquitetura não resolvida.",
    "Contrato obrigatório ausente ou contraditório.",
    "Write scope sobrepõe lane ativa.",
    "Aceitação não pode ser demonstrada por teste ou evidência."
  ],
  "acceptance_criterion_ids": [
    "AC-ISSUE-0131-01",
    "AC-ISSUE-0131-02",
    "AC-ISSUE-0131-03",
    "AC-ISSUE-0131-04"
  ],
  "governing_adrs": [
    "ADR-003",
    "ADR-006",
    "ADR-007",
    "ADR-008",
    "ADR-018",
    "ADR-023",
    "ADR-024",
    "ADR-026"
  ],
  "requirement_basis": "DERIVED_CONTROL",
  "requirements_review_status": "PASS",
  "bounded_context": "BC-001",
  "context_map_dependencies": [],
  "domain_model_impact": "PUBLIC_CONTRACT",
  "ddd_review_status": "PASS",
  "adr_review_status": "PASS",
  "adr_baseline": "SAR-v2.9-PHASE-F",
  "applicable_specifications": [
    "SPEC-001",
    "SPEC-004"
  ],
  "specification_review_status": "PASS",
  "specification_baseline": "SAR-v2.9-PHASE-F",
  "phase_f_review": {
    "status": "PASS",
    "dependencies": {
      "status": "PASS",
      "count": 2,
      "items": [
        "STORY-0706",
        "STORY-0707"
      ]
    },
    "files": {
      "status": "PASS",
      "allow_paths": [
        "contracts/contexts/engineering_governance/fnd/migrations-ci-secret-dependency-scan-e-telemetria-mini/consolidacao/**",
        "docs/02-architecture/design-reviews/migrations-ci-secret-dependency-scan-e-telemetria-mini/consolidacao/**"
      ],
      "deny_paths": [
        "src/**/epic-*",
        "src/**/issue-*"
      ]
    },
    "api": {
      "applicability": "NOT_APPLICABLE",
      "status": "PASS",
      "contracts": [],
      "contract_sources": []
    },
    "database": {
      "applicability": "APPLICABLE",
      "status": "PASS",
      "authorities": [
        "ADR-018",
        "ADR-023",
        "ADR-024",
        "ADR-026"
      ],
      "migration_required": true,
      "rollback_required": true
    },
    "frontend": {
      "applicability": "NOT_APPLICABLE",
      "status": "PASS",
      "authorities": []
    },
    "geo": {
      "applicability": "NOT_APPLICABLE",
      "status": "PASS",
      "authorities": []
    },
    "ai": {
      "applicability": "NOT_APPLICABLE",
      "status": "PASS",
      "authorities": [],
      "protocol_required": false
    },
    "tests": {
      "status": "PASS",
      "items": [
        "test_story_0021_slice_consolidation"
      ]
    },
    "artifacts": {
      "applicability": "EVIDENCE_ONLY",
      "status": "PASS",
      "kinds": [],
      "evidence": [
        "evidence/implementation/epic-005/story-0021/",
        "commit candidato e relatório de testes"
      ],
      "contract": null
    },
    "acceptance_criteria": {
      "status": "PASS",
      "count": 4,
      "ids": [
        "AC-ISSUE-0131-01",
        "AC-ISSUE-0131-02",
        "AC-ISSUE-0131-03",
        "AC-ISSUE-0131-04"
      ]
    },
    "review": {
      "status": "PASS",
      "required_roles": [
        "Arquiteto",
        "Reviewer"
      ],
      "same_candidate_commit": true
    }
  },
  "sprint_review_status": "PASS",
  "sprint_review_baseline": "SAR-v2.9-PHASE-F",
  "phase_g_review": {
    "status": "PASS",
    "risk_tier": "HIGH",
    "applicable_controls": [
      "CTO-001",
      "CTO-002",
      "CTO-003",
      "CTO-004",
      "CTO-005",
      "CTO-006",
      "CTO-008",
      "CTO-010",
      "CTO-011",
      "CTO-012",
      "CTO-013",
      "CTO-015"
    ],
    "non_applicable_controls": [
      "CTO-007",
      "CTO-009",
      "CTO-014"
    ],
    "required_evidence": [
      "contracts/operations/slo-sli-catalog.yaml",
      "docs/05-operations/CAPACITY_AND_SCALING.md",
      "contracts/operations/lock-and-queue-policy.yaml",
      "contracts/operations/external-dependency-register.csv",
      "contracts/operations/vendor-exit-matrix.csv",
      "contracts/operations/cost-model.yaml",
      "docs/05-operations/COST_AND_UNIT_ECONOMICS.md",
      "contracts/operations/recovery-objectives.yaml",
      "docs/05-operations/BACKUP_RESTORE.md",
      "contracts/operations/version-and-rollback-matrix.yaml",
      "docs/03-engineering/DATABASE_MIGRATIONS.md",
      "docs/05-operations/OBSERVABILITY.md",
      "docs/04-quality/THREAT_MODEL.md",
      "docs/04-quality/SECURITY_PRIVACY_LGPD.md"
    ],
    "production_gate": "BENCHMARK_AND_OPERATIONS_GATES"
  },
  "cto_review_status": "PASS",
  "cto_review_baseline": "SAR-v3.0-PHASE-G"
}
